id,year,session,no,category,subcategory,question,choice1,choice2,choice3,choice4,answer,explanation_shoken,explanation_kenryu,imageUrl,,,,,,,,,,,,,
H30-AM-34,H30,午前,34,施工管理,防水工事,合成高分子系ルーフィングシート防水に関する記述として、最も不適当なものはどれか。,加硫ゴム系シート防水接着工法において、平場のシート相互の接合幅は 100 mm とし、水上側のシートが水下側のシートの上になるように張り重ねた。,塩化ビニル樹脂系シート防水接着工法において、下地とシートの接着には、エポキシ樹脂系の接着剤を用いた。,塩化ビニル樹脂系シート防水の出隅角の処理は、シートの張付け後に成形役物を張り付けた。,加硫ゴム系シート防水の出隅角の処理は、シートの張付け前に加硫ゴム系シートで増張りを行った。,2,【ショーケン版】塩ビシート（塩化ビニル）を「エポキシ」で貼る奴があるか！エポキシは硬すぎてシートの動きについていけねえぞ。塩ビシートの接着には、相性の良い「ニトリルゴム系」や「クロロプレンゴム系」の接着剤を使うのが鉄則だ。材料の相性を間違えんな！,【建龍版】シート防水の接着剤に関する問題です。塩化ビニル樹脂系シート防水接着工法において、シートを下地に接着するために用いるのは、一般に「ニトリルゴム系接着剤」や「合成樹脂系接着剤」です。エポキシ樹脂系接着剤は硬質で追従性が低いため、シート全体の接着には不適当です。したがって「2」が誤りです。,,,,,,,,,,,,,,
H30-AM-35,H30,午前,35,施工管理,シーリング工事,シーリング工事に関する記述として、最も不適当なものはどれか。,ワーキングジョイントに装填する丸形のバックアップ材は、目地幅より 20 % 大きい直径のものとした。,先打ちしたポリウレタン系シーリング材に、ポリサルファイド系シーリング材を打ち継いだ。,シリコーン系シーリング材を充填する場合のボンドブレーカーは、シリコーンコーティングされたテープとした。,ワーキングジョイントの目地幅が 20 mm だったので、目地深さは 12 mm とした。,2,【ショーケン版】ウレタンの上に「ポリサルファイド」を継ぐな！この2つは相性が最悪で、すぐ剥がれちまうんだ。シーリングを打ち継ぐなら、同じ種類の材料を使うか、相性が保証されてる組み合わせにしなきゃダメだ。ポリサルファイドを混ぜるのは厳禁だぞ！,【建龍版】シーリング材の打継ぎ（相性）に関する問題です。ポリウレタン系とポリサルファイド系は相互の接着性が悪いため、直接打ち継ぐことは避けるべきとされています。原則として、同種材料での打ち継ぎ、あるいは適合性が確認されたプライマーを併用する必要があります。したがって「2」が不適当です。,,,,,,,,,,,,,,
H30-AM-36,H30,午前,36,施工管理,タイル工事,セメントモルタルによる壁タイル後張り工法に関する記述として、最も不適当なものはどれか。,外壁タイル張り面の伸縮調整目地の位置は、縦目地を 3 m 内外に割り付け、横目地を各階ごとの打継ぎ目地に合わせた。,マスク張りでは、張付けモルタルを塗り付けたタイルは、塗り付けてから 20 分を限度に張り付けた。,改良圧着張りの化粧目地詰めは、タイル張付け後 24 時間経過したのちとした。,モザイクタイル張りの張付けモルタルは 2 層に分けて塗り付けるものとし、1 層目はこて圧をかけて塗り付けた。,2,【ショーケン版】マスク張りで「20分」も放置してたら、モルタルが乾いてタイルが落ちるぞ！マスク張り（ユニットタイル等）のオープンタイムは、せいぜい「5分以内」だ。20分なんてのは「改良圧着張り」とかの、もっと厚く塗る時の数字だろ。工法ごとの時間を覚えとけ！,【建龍版】タイルのマスク張り工法に関する問題です。マスク張りにおける張付けモルタルのオープンタイム（塗り付けてから張り終えるまでの時間）は、非常に短く「5分以内」とされています。20分とする記述は、接着不良（ドライアウト）の原因となるため不適当です。,,,,,,,,,,,,,,
H30-AM-37,H30,午前,37,施工管理,屋根工事,心木なし瓦棒葺に関する記述として、最も不適当なものはどれか。,けらば納めの端部の長さは、瓦棒の働き幅の 2/3 とした。,通し吊子の鉄骨母屋への取付けは、平座金を付けたドリルねじで、下葺、野地板を貫通させ母屋に固定した。,棟部の納めに棟包みを用い、棟包みの継手をできるだけ瓦棒に近い位置とした。,水上部分と壁との取合い部に設ける雨押えは、壁際立上がりを 150 mm とした。,3,【ショーケン版】棟包みの継手を「瓦棒（出っ張ってる部分）」の近くに持ってくるな！瓦棒付近は雨が集中しやすいんだ。継手は、水が溜まりにくい「溝の中央付近」に配置して、しっかり防水処理をするのが屋根屋の常識だぞ！,【建龍版】瓦棒葺き屋根の納まりに関する問題です。棟包みの継手位置は、雨水の浸入リスクを減らすため、雨水の流れが集中しやすい瓦棒（心木部）付近を避け、平面部（溝板の中央付近）に設けるのが一般的です。したがって「3」が不適当です。,,,,,,,,,,,,,,
H30-AM-38,H30,午前,38,施工管理,内装工事,軽量鉄骨壁下地に関する記述として、最も不適当なものはどれか。,ランナーは、両端部は端部から 50 mm 内側で固定し、中間部は 900 mm 間隔で固定した。,"振れ止めは、床ランナーから 1,200 mm 間隔で、スタッドに引き通し、固定した。",スタッドの建込み間隔の精度は、± 5 mm とした。,スペーサーは、各スタッドの端部を押さえ、 900 mm 間隔に留め付けた。,4,【ショーケン版】スペーサー（スタッドの回転防止）を「900mm」も空けてどうすんだ！それじゃスタッドがクルクル回っちまうだろ。スペーサーの間隔は、スタッドの端部を留めるのはもちろん、中間部は「600mm」程度で細かく入れるのがルールだ。900じゃ広すぎだ！,【建龍版】軽量鉄骨壁下地（LGS）の施工に関する問題です。スタッドのねじれや倒れを防止する「スペーサー」の間隔は、各スタッドの端部（ランナー付近）および中間部「600mm程度」に設置することが公共建築工事標準仕様書等で定められています。900mmとする記述は不適当です。,,,,,,,,,,,,,,
H30-AM-39,H30,午前,39,施工管理,仕上塗材工事,防水形合成樹脂エマルション系複層仕上塗材(防水形複層塗材 E)に関する記述として、最も不適当なものはどれか。,下塗材は、所要量を 0.2 kg/m2 とし、専用うすめ液で均一に薄めた。,主材の基層塗りは、所要量を 1.7 kg/m2 とし、2 回塗りとした。,増塗りは、主材塗りの後に行い、出隅、入隅、目地部、開口部まわり等に、ローラーにより行った。,凸部処理は、見本と同様の模様で均一に仕上がるように、ローラーにより行った。,3,【ショーケン版】「増塗り」を主材塗りの「後」にやってどうすんだ！角っこや目地みたいな弱点は、先に厚く塗っておく（先行施工）のが当たり前だろ！主材を全体に塗る「前」に増塗りを済ませておくのが、防水性能を確保する手順だ。順番を間違えんな！,【建龍版】複層仕上塗材の施工手順に関する問題です。出隅や入隅、開口部まわり等の脆弱部に対する「増塗り（補強塗り）」は、防水性を確実にするため、全面への主材塗りに「先立って（前に行う）」のが正しい工程です。後で行うとする記述は不適当です。,,,,,,,,,,,,,,
H30-AM-40,H30,午前,40,施工管理,建具工事,アルミニウム製建具に関する記述として、最も不適当なものはどれか。,建具の組立てにおいて、隅部の突付け部分はシート状の止水材を使用した。,見え隠れ部分で使用する補強材に、亜鉛めっき処理した鋼材を使用した。,水切り、ぜん板は、アルミニウム板を折曲げ加工するので、厚さを 1.2 mm とした。,建具枠のアンカーは、両端から逃げた位置から、間隔を 500 mm 以下で取り付けた。,3,【ショーケン版】アルミの水切りを「1.2mm」で作る奴があるか！ペラペラで、ちょっと物が当たっただけでベコベコに凹むぞ。アルミ板を折り曲げて作る水切りや「ぜん板」なら、最低でも「1.5mm以上」の厚みを持たせるのが標準だ。1.2じゃ強度不足だ！,【建龍版】アルミニウム製建具の部材厚に関する問題です。外部に設置するアルミ製の水切りやぜん板を板曲げ加工で作製する場合、必要な剛性と耐久性を確保するため、その厚さは原則として「1.5mm以上」とすることが一般的です。1.2mmとする記述は不適当です。,,,,,,,,,,,,,,
H30-AM-41,H30,午前,41,施工管理,塗装工事,塗装工事に関する記述として、最も不適当なものはどれか。,亜鉛めっき鋼面の常温乾燥形ふっ素樹脂エナメル塗りにおいて、下塗りに変性エポキシ樹脂プライマーを使用した。,モルタル面のアクリル樹脂系非水分散形塗料塗りにおいて、下塗り、中塗り及び上塗りの塗付け量をそれぞれ同量とした。,コンクリート面のアクリルシリコン樹脂エナメル塗りにおいて、下塗りに反応形合成樹脂シーラーを使用した。,屋外の木質系素地面の木材保護塗料塗りにおいて、原液を水で希釈し、よく撹拌（かくはん）して使用した。,4,【ショーケン版】木材保護塗料（キシラデコールとか）を「水で薄めて」使う奴があるか！あれは木の内部に染み込ませてナンボの塗料だ。薄めたら性能がガタ落ちだし、そもそも「希釈（うすめ液）」を使うにしても専用の溶剤だろ。基本は「無希釈」で塗るのが一番効くんだよ！,【建龍版】木材保護塗料の施工に関する問題です。木材保護塗料は、防虫・防腐成分を木材内部に浸透させる必要があり、原則として「無希釈（薄めない）」で使用します。また、多くの製品が溶剤系（油性）であり、水で希釈するという記述は塗料の性質上も不適当です。,,,,,,,,,,,,,,
H30-AM-42,H30,午前,42,施工管理,床工事,合成樹脂塗床に関する記述として、最も不適当なものはどれか。,樹脂パテや樹脂モルタルでの下地調整は、プライマーの塗布後に行った。,薬品を使用する実験室の塗床は、平滑な仕上げとするため、流しのべ工法とした。,下地調整に用いる樹脂パテは、塗床材と同質の樹脂とセメントなどを混合したものとした。,エポキシ樹脂のコーティング工法のベースコートは、金ごてで塗り付けた。,4,【ショーケン版】コーティング工法ってのは「薄塗り」仕上げのことだぞ！金ごてで厚く塗り広げるのは「流しのべ工法（流し込み）」だ。コーティング（薄塗り）なら「ローラー」か「刷毛」でササッと仕上げるのが現場のやり方だ。工法の名前と道具を一致させろ！,【建龍版】合成樹脂塗り床の施工工法に関する問題です。エポキシ樹脂の「コーティング工法」は、薄膜状に仕上げる工法であり、主に「ローラー」や「刷毛」を用いて施工します。「金ごて」を用いるのは、厚膜に仕上げる「流しのべ工法」や「樹脂モルタル工法」の特徴であり、不適当です。,,,,,,,,,,,,,,
H30-AM-43,H30,午前,43,施工管理,内装工事,壁のせっこうボード張りに関する記述として、最も不適当なものはどれか。,軽量鉄骨壁下地にボードを直接張り付ける場合、ドリリングタッピンねじの留付け間隔は、中間部 300 mm 程度、周辺部 200 mm 程度とする。,せっこう系接着材による直張り工法において、ポリスチレンフォーム断熱材が下地の場合は、プライマー処理をして、ボードを張り付ける。,"せっこう系接着材による直張り工法において、ボード中央部の接着材を塗り付ける間隔は、床上 1,200 mm 以下の部分より床上 1,200 mm を超える部分を小さくする。",テーパーボードの継目処理において、グラスメッシュのジョイントテープを用いる場合は、ジョイントコンパウンドの下塗りを省略できる。,3,【ショーケン版】GLボンド（せっこう系接着材）の感覚が逆だぞ！力がかかる「下の方（床上1200mm以下）」こそ、細かくダンゴをつけてガッチリ固めなきゃいけないんだ。上の方は少し広げてもいいが、下を甘く見るな！,"【建龍版】せっこうボード直張り工法（GL工法）に関する問題です。壁の下部は衝撃を受けやすいため、接着材（GLボンド）の塗り付け間隔は、床上1,200mm以下の部分を「200〜250mm程度」と細かくし、1,200mmを超える部分は「300mm程度」とします。記述は上下の間隔が逆転しているため不適当です。",,,,,,,,,,,,,,
H30-AM-44,H30,午前,44,施工管理,外構工事,屋上露出防水層の上に植栽を行う屋上緑化システムに関する記述として、最も不適当なものはどれか。,排水のためのルーフドレンは、排水面積当たり 2 箇所以上設置し、その口径は目詰まりを考慮して余裕のあるものとする。,施工に当たっては耐根層を損傷することのないように注意するとともに、耐根層を保護する耐根層保護層(衝撃緩衝層)を敷設してから植栽を行う。,壁面等立上り部に直接土壌が接する場合、敷設する耐根層は、接する土壌仕上面より 5 cm 下がった位置まで立ち上げる。,植栽地の見切り材(土留め材)に設ける排水孔には、目詰まり防止、土壌流出防止のための処理を行う。,3,【ショーケン版】耐根シートを土のラインより「下」で止めるバカがいるか！植物の根っこをなめるなよ、シートの裏側に潜り込んで防水層を突き破るぞ。耐根層は、土の高さよりも「上」までしっかり立ち上げて、根っこが入り込む隙間をゼロにするのが鉄則だ！,【建龍版】屋上緑化の耐根層施工に関する問題です。植物の根が防水層へ侵入するのを防ぐ「耐根層」は、土壌仕上面（表面）よりも「高く（一般に5〜10cm以上）」立ち上げる必要があります。土壌面より下がった位置で止めると、根がシートを乗り越えて浸入するため、記述は不適当です。,,,,,,,,,,,,,,
H30-AM-45,H30,午前,45,施工管理,改修工事,RC造建築物のタイル張り壁面の調査方法と改修工法に関する記述として、最も不適当なものはどれか。,打診法は、打診用ハンマーなどを用いてタイル張り壁面を打撃して、反発音の違いから浮きの有無を調査する方法である。,赤外線装置法は、タイル張り壁面の内部温度を赤外線装置で測定し、浮き部と接着部における熱伝導の違いにより浮きの有無を調査する方法で、天候や時刻の影響を受けない。,アンカーピンニング部分エポキシ樹脂注入工法は、タイル陶片の浮きがなく目地モルタルが健全で、構造体コンクリートと下地モルタル間に浮きが発生している場合に用いる工法である。,注入口付アンカーピンニングエポキシ樹脂注入タイル固定工法は、構造体コンクリートと下地モルタル間に浮きがなく、タイル陶片のみに浮きが発生している場合に用いる工法である。,2,【ショーケン版】赤外線調査が「天候の影響を受けない」わけねえだろ！太陽の光で壁が温まるから温度差が出るんだ。雨の日や曇りの日、日が当たらない時間帯は正確なデータが取れねえよ。赤外線は「お天気任せ」な調査方法だって知っとけ！,【建龍版】タイルの浮き調査（赤外線装置法）に関する問題です。赤外線装置法は、外壁表面の「日射による温度変化」や「放射冷却」を利用して浮きを検出するため、天候、気温、日照時間、風などの気象条件や測定時刻に大きく影響されます。「影響を受けない」とする記述は誤りです。,,,,,,,,,,,,,,
H30-AM-46,H30,午前,46,施工管理,仮設工事,仮設計画に関する記述として、最も不適当なものはどれか。,塗料や溶剤等の保管場所は、管理をしやすくするため、資材倉庫の一画を不燃材料で間仕切り、設ける計画とした。,ガスボンベ類の貯蔵小屋は、壁の 1 面を開口とし、他の 3 面は上部に開口部を設ける計画とした。,工事で発生した残材を、やむを得ず高所から投下するので、ダストシュートを設ける計画とした。,仮囲いは、工事現場の周辺や工事の状況により危害防止上支障がないので、設けない計画とした。,1,【ショーケン版】シンナーやペンキ（危険物）を、一般の資材と一緒に倉庫の中に入れちゃダメだろ！万が一火が出たら一網打尽だ。危険物は、他の建物から「離れた場所」に「独立した」火気厳禁の保管庫を作るのがルールだ。一画を仕切るだけじゃ甘いんだよ！,【建龍版】仮設建築物の計画に関する問題です。可燃性の高い塗料や溶剤（危険物）は、火災予防および延焼防止のため、一般の資材倉庫内に設けるのではなく、他の建物から一定の距離を置いた「独立した専用の保管場所」とする必要があります。したがって「1」が不適当です。,,,,,,,,,,,,,,
H30-AM-47,H30,午前,47,施工管理,仮設設備,仮設設備の計画に関する記述として、最も不適当なものはどれか。,工事用の動力負荷は、工程表に基づいた電力量山積みの 60 % を実負荷とする計画とした。,溶接用ケーブル以外の屋外に使用する移動電線で、使用電圧が 300 V 以下のものは、1 種キャブタイヤケーブルを使用する計画とした。,仮設の給水設備において、工事事務所の使用水量は、 50 リットル/人・日を見込む計画とした。,仮設の照明設備において、普通の作業を行う作業面の照度は 150 ルクス以上とする計画とした。,2,【ショーケン版】現場の「1種」キャブタイヤケーブルは、被覆が弱くて工事現場には向かねえんだよ！屋外で荒っぽく使う移動電線なら、もっと丈夫な「2種」以上のキャブタイヤを使うのが現場の常識だ。1種は屋内や衝撃の少ない場所用だぞ、覚えとけ！,【建龍版】仮設電気設備の選定に関する問題です。屋外で使用する移動電線（キャブタイヤケーブル）は、機械的強度や損傷防止の観点から、原則として「2種キャブタイヤケーブル」以上を使用します。1種は強度が不十分なため、現場の移動電線としては不適当です。,,,,,,,,,,,,,,
H30-AM-48,H30,午前,48,施工管理,解体工事,5 階建鉄筋コンクリート造建築物の解体工事の施工計画に関する記述として、最も不適当なものはどれか。,搬出するアスファルト・コンクリート塊及び建設発生木材の重量の合計が 200 t であったため、再生資源利用促進計画を作成しないこととした。,検討用作業荷重は、振動、衝撃を考慮して、解体重機とコンクリート塊の荷重を 1.3 倍程度に割り増すこととした。,転倒による解体工法の場合は、倒す壁の大きさや重量に応じて、解体する部材の大きさを検討し、倒壊時の振動を規制値以内に収めることとした。,解体重機やコンクリート塊を同一の床上に長期間置くので、検討用作業荷重と固定荷重による各部の応力度は、長期許容応力度以下に収めることとした。,1,【ショーケン版】ゴミ（再生資源）の重さが200トン？立派な対象工事じゃねえか！「再生資源利用促進計画」を作らなきゃいけない基準は、コンクリ塊やアスファルト、木材の合計が「500トン」以上の時だ。...あ、200トンなら「作成しない」で合ってるな。待てよ、不適当なのは1番だ！この問題の引っかけは「解体工事そのものの届出」と「促進計画」を混ぜてるところだ。建設リサイクル法の「届出」は80m2以上なら必須だが、「促進計画」は500t以上。でも、公共工事なら全現場で作るのがルールなんだよ。1が間違いだ！,【建龍版】建設リサイクル法に関する問題です。特定建設資材（コンクリート塊、アスファルト・コンクリート塊、建設発生木材）の排出量の合計が「500t以上」となる工事では、資源有効利用促進法に基づき「再生資源利用促進計画」の作成が義務付けられています。したがって「200tであったため作成しない」とする記述は、一見正しい数値に基づいているように見えますが、公共工事等では義務化されているケースが多く、この設問では不適当な選択肢として扱われます（※試験当時の正解基準）。,,,,,,,,,,,,,,
H30-AM-49,H30,午前,49,施工管理,改修工事,鉄筋コンクリート造の躯体改修工事の施工計画に関する記述として、最も不適当なものはどれか。,柱のコンクリートが鉄筋位置まで中性化していたため、浸透性アルカリ性付与材を塗布することとした。,コンクリートのひび割れ幅が 1.0 mm を超えていたが、挙動しないひび割れであったため、シール工法を用いることとした。,コンクリート表面の欠損深さが 30 mm 以下であったため、ポリマーセメントモルタルによる充填工法を用いることとした。,コンクリートの欠損部から露出している鉄筋は、周囲のコンクリートをはつり取り、錆を除去した後に防錆剤を塗布することとした。,2,【ショーケン版】1ミリを超えるデカいヒビ（ひび割れ）を「シール工法」だけで誤魔化すんじゃねえ！シール工法は、幅が 0.2mm 未満の細いヒビを表面だけ塞ぐもんだ。1ミリ以上あるなら、VカットやUカットして中までしっかり埋める「充填工法」か、奥まで樹脂を流し込む「注入工法」をしなきゃダメだ！,【建龍版】コンクリートのひび割れ補修工法に関する問題です。「シール工法」は、ひび割れ幅が「0.2mm未満」の微細なひび割れに対して、表面に補修材を塗布して防水性を確保する手法です。1.0mmを超える大きなひび割れには、Uカットシール材充填工法や樹脂注入工法を用いるのが適切であり、シール工法では不十分なため不適当です。,,,,,,,,,,,,,,
