id,year,session,no,category,subcategory,question,choice1,choice2,choice3,choice4,answer,explanation_shoken,explanation_kenryu,imageUrl,,,,,,,,,,,,,
H30-AM-18,H30,午前,18,建築学,空気調和設備,空気調和設備に関する記述として、最も不適当なものはどれか。,パッケージユニット方式は、小容量の熱源機器を建物内に多数分散配置する方式であり、セントラルシステムに比較して保守管理に手間を要する方式である。,ファンコイルユニット方式における 4 管式は、2 管式と比較してゾーンごとの冷暖房同時運転が可能で、室内環境の制御性に優れている方式である。,二重ダクト方式は、2 系統のダクトで送風された温風と冷風を、混合ユニットにより熱負荷に応じて混合量を調整して吹き出す方式である。,単一ダクト方式における CAV 方式は、負荷変動に対して風量を変える方式である。,4,【ショーケン版】CAV（シーエーブイ）の「C」は「Constant（一定）」のCだ！風量を「変えない」のがCAV、風量を「変える」のはVAV（バリアブル）だろ！アルファベットの意味を知ってりゃ一発でわかるサービス問題だぞ！,【建龍版】空調方式の制御に関する問題です。CAV（Constant Air Volume）は「定風量」方式であり、風量を「一定」に保ちながら送風温度を調節する方式です。負荷変動に応じて風量を「変える」のはVAV（Variable Air Volume：可変風量）方式であり、記述は不適当です。,,,,,,,,,,,,,,
H30-AM-19,H30,午前,19,建築学,消火設備,消火設備に関する記述として、最も不適当なものはどれか.,不活性ガス消火設備は、二酸化炭素などによる冷却効果、窒息効果により消火するもので、博物館の収蔵庫に適している。,粉末消火設備は、粉末消火剤による負触媒効果、窒息効果により消火するもので、自動車車庫に適している。,泡消火設備は、泡状の消火剤による冷却効果、窒息効果により消火するもので、電気室に適している。,水噴霧消火設備は、微細な霧状の水による冷却効果、窒息効果により消火するもので、指定可燃物貯蔵所に適している。,3,【ショーケン版】電気室で「泡（水気）」をぶっかける奴がいるか！ショートして火花が散って余計にひどいことになるだろ。電気室の火災には、ガスで酸欠にして消す「不活性ガス消火設備」が鉄則だ。泡は駐車場（車庫）とかで使うもんだぞ！,【建龍版】消火剤の適応性に関する問題です。泡消火設備は水分を含むため、電気機器が設置されている「電気室」で使用すると、感電や短絡（ショート）の危険があります。電気室には、汚損が少なく電気絶縁性の高い「不活性ガス消火設備」が適しています。したがって「3」が不適当です。,,,,,,,,,,,,,,
H30-AM-20,H30,午前,20,法規,公共工事標準請負契約約款,請負契約に関する記述として、公共工事標準請負契約約款上、誤っているものはどれか。,受注者は、工事の施工に当たり、設計図書に示された施工条件と実際の工事現場が一致しないことを発見したときは、その旨を直ちに監督員に通知し、その確認を請求しなければならない。,発注者は、受注者が契約図書に定める主任技術者若しくは監理技術者を設置しなかったときは、契約を解除することができる。,工事の施工に伴い通常避けることができない騒音、振動、地盤沈下、地下水の断絶等の理由により第三者に損害を及ぼしたときは、原則として、発注者がその損害を負担しなければならない。,現場代理人は、契約の履行に関し、工事現場に原則として常駐し、その運営、取締りを行うほか、請負代金額の変更及び契約の解除に係る権限を行使することができる。,4,【ショーケン版】現場代理人（所長）にそんなデカい権限はねえよ！「金の変更（代金増減）」や「クビ（契約解除）」を決めるのは、会社のハンコを持ってる社長（経営者）の仕事だ。所長はあくまで「現場を回す」のが仕事。越権行為は法律違反だぞ！,【建龍版】現場代理人の権限に関する問題です。現場代理人は、工事現場の運営や取締りに関する一切の権限を持ちますが、原則として「請負代金額の変更」や「契約の解除」といった、契約の根幹に関わる重要な権限は有していません。これらについては、別途委任を受けている場合を除き、受注者（本人）が行う必要があります。したがって「4」が誤りです。,,,,,,,,,,,,,,
H30-AM-21,H30,午前,21,施工管理,仮設工事,乗入れ構台の計画に関する記述として、最も不適当なものはどれか。,構台の支柱の位置は、使用する施工機械、車両の配置によって決めた。,道路から構台までの乗込みスロープの勾配は、 1/8 とした。,1 階床面と現状地盤面がほぼ同じ高さなので、構台の床面は 1 階床面より 1.2 m 高くした。,山留めの切梁支柱と乗入れ構台の支柱は、荷重に対する安全性を確認した上で兼用した。,3,【ショーケン版】構台の床を「1.2m」も上げたら、ダンプが荷台を上げられねえだろ！構台ってのは、現場の1階の床と同じか、せいぜい「15cm〜30cm」くらい高くして、水が入らねえようにする程度で十分なんだ。1.2mは高すぎて作業効率がガタ落ちだぞ！,【建龍版】乗入れ構台の計画に関する問題です。乗入れ構台の床面高さは、一般に建築物の1階床（1FL）と「ほぼ同じ高さ」か、水はけ等を考慮してわずかに高く設定します。1.2mもの段差を設けると、車両の出入りや作業に支障をきたすため、不適当な計画です。,,,,,,,,,,,,,,
H30-AM-22,H30,午前,22,施工管理,土工事,土工事に関する記述として、最も不適当なものはどれか。,根切り底面下に被圧帯水層があり、盤ぶくれの発生が予測されたので、ディープウェル工法で地下水位を低下させた。,ボイリング対策として、周辺井戸の井戸枯れや軟弱層の圧密沈下を検討し、ディープウェル工法で地下水位を低下させた。,床付け地盤が凍結したので、凍結した部分は良質土と置換した。,ヒービングの発生が予測されたので、ウェルポイントで掘削場内外の地下水位を低下させた。,4,【ショーケン版】ヒービングを「水抜き（ウェルポイント）」で直せると思うなよ！ヒービングは粘土が「重みで回り込む」現象だ。水を抜いたって粘土の柔らかさは変わらねえ。ヒービングを止めたきゃ、山留めを深く打ち込むか、地盤改良でガチガチに固めるしかないんだよ！,【建龍版】地盤の破壊現象への対策に関する問題です。「ヒービング」は、軟弱な粘性土地盤において、山留め壁背後の土圧により掘削底面が盛り上がる現象です。対策としては「山留め壁の根入れ長を深くする」や「地盤改良」が有効であり、地下水位を低下させるウェルポイント工法は主たる対策としては不適当です。,,,,,,,,,,,,,,
H30-AM-23,H30,午前,23,施工管理,山留め工事,ソイルセメント柱列山留め壁に関する記述として、最も不適当なものはどれか。,山留め壁の構築部に残っている既存建物の基礎を貫通するためのロックオーガーの径は、ソイルセメント施工径より小さくする。,ソイルセメントの硬化不良部分は、モルタル充填や背面地盤への薬液注入などの処置を行う。,セメント系注入液と混合撹拌する原位置土が粗粒土になるほど、ソイルセメントの一軸圧縮強度が大きくなる。,ソイルセメントの中に挿入する心材としては、H 形鋼などが用いられる。,1,【ショーケン版】ロックオーガー（障害物を壊すドリル）の穴がソイルセメントより「小さい」と、後で本番のドリルが引っかかって回らなくなるだろ！障害物を取り除く時は、後でソイルセメントがスムーズに打てるように、施工径と同じか「少し大きい」径でブチ抜くのが現場の定石だ！,【建龍版】ソイルセメント柱列壁の施工に関する問題です。既存構造物などの障害物を除去（ロックオーガーによる先行掘削）する場合、その掘削径は、その後に施工するソイルセメントの施工径を確保するため、「施工径と同等か、それ以上」とするのが一般的です。小さくすると本掘削に支障が出るため不適当です。,,,,,,,,,,,,,,
H30-AM-24,H30,午前,24,施工管理,杭工事,アースドリル工法による場所打ちコンクリート杭地業に関する記述として、最も不適当なものはどれか。,掘削終了後、鉄筋かごを建て込む前に1次孔底処理を行い、有害なスライムが残留している場合には、コンクリートの打込み直前に2次孔底処理を行う。,安定液は、必要な造壁性があり、できるだけ高粘性、高比重のものを用いる。,掘削深さの確認は、検測器具を用いて孔底の3箇所以上で検測する。,地下水がなく孔壁が自立する地盤では、安定液を使用しないことができる。,2,【ショーケン版】安定液の比重を上げすぎんな！比重や粘度が高すぎると、コンクリを打つ時に液がうまく入れ替わらずに、杭の周りに泥壁が厚く残っちまう（泥壁の肥大）。コンクリの品質を落とさないよう、安定液は機能を保てる範囲で「できるだけ低粘性・低比重」に管理するのが鉄則だ！,【建龍版】アースドリル工法の安定液管理に関する問題です。安定液（ベントナイト液等）は、孔壁を保護する造壁性が必要ですが、比重や粘性が高すぎるとコンクリート置換が不完全になり、杭の支持力低下やコンクリートへの泥土混入を招きます。したがって、管理基準を満たす範囲内で「できるだけ低比重・低粘性」とするのが適切であり、「できるだけ高粘性・高比重」とする記述は不適当です。,,,,,,,,,,,,,,
H30-AM-25,H30,午前,25,建築学,鉄筋工事,異形鉄筋の定着等に関する記述として、最も不適当なものはどれか。ただし、d は異形鉄筋の呼び名の数値とする。,大梁主筋に SD 345 を用いる場合の直線定着の長さは、コンクリート強度が同じならば、同径の SD 390 を用いる場合と同じである。,梁下端筋の柱梁接合部への定着は、原則として、梁下端筋を曲げ上げる形状で定着させる。,梁端の上端筋をカットオフする場合には、梁の端部から当該梁の内法長さの 1/4 となる点を起点とし、15 d 以上の余長を確保する。,梁の主筋を柱内に折曲げ定着とする場合には、仕口面からの投影定着長さを柱せいの 3/4 倍以上とする。,1,【ショーケン版】鉄筋の強度（SD345と390）が違うのに、定着長さが同じなわけねえだろ！強度が強い鉄筋（SD390）ほど、コンクリから抜けないように「より長く」埋め込まにゃならん。強度が同じなのは「フックの形状」とかの話だ。基本を間違えんな！,【建龍版】鉄筋の定着長さに関する問題です。鉄筋の定着長さ $L_d$ は、鉄筋の許容引張応力度（強度）に比例し、コンクリートの許容付着応力度に反比例します。強度の高い SD390 は、SD345 よりも長い定着長さが必要となるため、「同じである」とする記述は不適当です。,,,,,,,,,,,,,,
H30-AM-26,H30,午前,26,施工管理,鉄筋工事,鉄筋の機械式継手に関する記述として、最も不適当なものはどれか。,ねじ節継手とは、熱間形成されたねじ節鉄筋の端部に鋼管(スリーブ)をかぶせた後、外側から加圧して鉄筋表面の節にスリーブを食い込ませて接合する工法である。,充填継手とは、内面に凹凸のついた比較的径の大きい鋼管(スリーブ)に異形鉄筋の端部を挿入した後、スリーブ内に高強度の無収縮モルタル等を充填して接合する工法である。,端部ねじ継手とは、端部をねじ加工した異形鉄筋、あるいは加工したねじ部を端部に圧接した異形鉄筋を使用し、雌ねじ加工されたカップラーを用いて接合する工法である。,併用継手は、2 種類の機械式継手を組み合わせることでそれぞれの長所を取り入れ、施工性を改良したものである。,1,【ショーケン版】「ねじ節継手」を「加圧」で食い込ませる？それは「冷間押抜き継手」とか別のやり方だろ！ねじ節継手ってのは、鉄筋自体がボルトみたいにねじになってて、カプラー（ナット）をクルクル回して繋ぐ工法だ。加圧なんてしねえよ！,【建龍版】機械式継手の種類に関する問題です。「ねじ節継手」は、鉄筋表面のねじ状の節を利用し、内部に雌ねじを切ったカプラーを「ねじ込んで」接合する工法です。記述にある「外側から加圧して食い込ませる」のは「圧着継手」の特徴であり、不適当です。,,,,,,,,,,,,,,
H30-AM-27,H30,午前,27,施工管理,型枠工事,型枠の設計に関する記述として、最も不適当なものはどれか。,固定荷重の計算に用いる型枠の重量は、0.4 kN/m2 とする。,合板せき板のたわみは、単純支持で計算した値と両端固定で計算した値の平均値とする。,型枠に作用する荷重及び外力に対し、型枠を構成する各部材それぞれの許容変形量は、 3 mm 以下を目安とする。,型枠の構造計算において、支保工以外の材料の許容応力度は、長期と短期の許容応力度の平均値とする。,4,【ショーケン版】型枠はコンクリを打つ間だけの「一時的なもん」だろ！だから構造計算に使うのは「短期許容応力度」そのままでいいんだよ。わざわざ「長期との平均」なんて中途半端な数字を使う必要はねえ。短期決戦なんだから短期の数字で勝負しろ！,【建龍版】型枠の構造設計に関する問題です。型枠は施工中の一時的な荷重を支える仮設構造物であるため、材料の許容応力度は原則として「短期許容応力度」を採用します。長期許容応力度との平均値を用いるという規定はなく、記述は不適当です。なお、部材の変形量は「3mm以下」とするのが一般的です。,,,,,,,,,,,,,,
H30-AM-28,H30,午前,28,施工管理,コンクリート工事,コンクリートの運搬及び打込みに関する記述として、最も不適当なものはどれか。,粗骨材の最大寸法が 25 mm の普通コンクリートを圧送する場合の輸送管の呼び寸法は、 100 A 以上とする。,コンクリートの圧送に先立ち圧送される先送りモルタルは、品質を低下させるおそれがあるので、型枠内には打ち込まない。,マスコンクリートの荷卸し時のコンクリート温度は、原則として、 35 °C 以下となるようにする。,高性能 AE 減水剤を用いた高強度コンクリートの練混ぜから打込み終了までの時間は、外気温にかかわらず、原則として、 120 分を限度とする。,3,【ショーケン版】マスコン（デカいコンクリ）は自分自身の熱でアツアツになるんだよ！だから荷卸しの時点で「40度」もあったら、後からヒビ割れだらけになっちまう。マスコンの温度制限は、もっと厳しく「35度以下」に抑えるのが現場のルールだぞ！,【建龍版】コンクリートの温度管理に関する問題です。マスコンクリートは水和熱による温度ひび割れのリスクが高いため、荷卸し時のコンクリート温度は原則として「35℃以下」とすることが定められています（JASS 5）。40℃とする記述は不適当です。,,,,,,,,,,,,,,
H30-AM-29,H30,午前,29,施工管理,コンクリート工事,コンクリートの養生に関する記述として、最も不適当なものはどれか。ただし、計画供用期間を指定する場合の級は標準とする。,連続的に散水を行って水分を供給する方法による湿潤養生は、コンクリートの凝結が終了した後に行う。,普通ポルトランドセメントを用いたコンクリートの打込み後 5 日間は、乾燥、振動等によって凝結及び硬化が妨げられないように養生する。,湿潤養生の期間は、早強ポルトランドセメントを用いたコンクリートの場合は、普通ポルトランドセメントを用いた場合より短くすることができる。,普通ポルトランドセメントを用いた厚さ 18 cm 以上のコンクリート部材においては、コンクリートの圧縮強度が 10 N/mm2 以上に達したことを確認すれば、以降の湿潤養生を打ち切ることができる。,4,【ショーケン版】コンクリの養生を切り上げるタイミングをなめんな！「5N」じゃまだ赤ん坊だぞ。普通セメントで養生を終わらせていいのは、強度が「10N/mm2」まで育ってからだ。5Nは「凍結しなくなる（初期凍害防止）」だけの数字だ、混同すんな！,【建龍版】コンクリートの養生終了時期に関する問題です。JASS 5 において、湿潤養生を打ち切ることができる圧縮強度の目安は、普通ポルトランドセメントの場合「10 N/mm2」以上とされています（※5 N/mm2 は寒中コンクリートの初期養生終了目安）。したがって、5 N/mm2 で打ち切ることができるとする記述は不適当です。,,,,,,,,,,,,,,
H30-AM-30,H30,午前,30,施工管理,鉄骨工事,高力ボルト接合に関する記述として、最も不適当なものはどれか。,ねじの呼びが M 22 のトルシア形高力ボルトの長さは、締付け長さに 35 mm を加えた値を標準とした。,ナット回転法による締付け完了後の検査は、1次締付け後の本締めによるナット回転量が 120 ° ± 30 ° の範囲にあるものを合格とした。,摩擦接合面は、すべり係数 0.45 以上を確保するため、グラインダー処理後、自然発生した赤さび状態を確認した。,ねじの呼びが M 22 の高力ボルトの 1 次締付けトルク値は、約 150 N・m とした。,2,【ショーケン版】ナット回転法の合格範囲を広げすぎだろ！「120° ± 45°」なんて、ゆるゆるかガチガチかのどっちかだぞ。正確な範囲は「120° ± 30°」だ。15度の差で摩擦力が変わっちまうんだよ。数字を正確に覚えろ！,【建龍版】高力ボルトのナット回転法に関する問題です。1次締付け完了後、さらにナットを120度回転させて本締めを行う際、その合格範囲は「120° ± 30°」と規定されています。45°とする記述は許容範囲が広すぎて不適当です。,,,,,,,,,,,,,,
H30-AM-31,H30,午前,31,施工管理,鉄骨工事,大空間鉄骨架構の建方に関する記述として、最も不適当なものはどれか。,総足場工法は、必要な高さまで足場を組み立てて、作業用の構台を全域にわたり設置し、架構を構築する工法である。,スライド工法は、作業構台上で所定の部分の屋根鉄骨を組み立てたのち、そのユニットを所定位置まで順次滑動横引きしていき、最終的に架構全体を構築する工法である。,移動構台工法は、移動構台上で所定の部分の屋根鉄骨を組み立てたのち、構台を移動させ、順次架構を構築していく工法である。,リフトアップ工法は、地組みした所定の大きさのブロックをクレーン等で吊り上げて架構を構築する工法である。,4,【ショーケン版】「リフトアップ」を「クレーンで吊る」だけだと思ってんのか？それはただの揚重だろ！リフトアップってのは、地面で大きな屋根とかを全部組んでから、ジャッキを使って「下から押し上げる（または引き上げる）」特殊な工法なんだよ。クレーンじゃ届かねえようなデカい屋根を上げる時に使うんだ！,【建龍版】鉄骨の特殊建方工法に関する問題です。「リフトアップ工法」は、大スパンの屋根架構などを地上付近で組み立て、ジャッキ等を用いて所定の高さまで「引き揚げる（または押し上げる）」工法を指します。通常のクレーンによる吊り上げとは区別される用語であり、記述は不適当です。,,,,,,,,,,,,,,
H30-AM-32,H30,午前,32,施工管理,木造工事,大断面集成材を用いる木造建築物に関する記述として、最も不適当なものはどれか。,接合金物のボルトの孔あけ加工の大きさについて、ねじの呼びが M 16 未満の場合は公称軸径に 1.5 mm を加えたものとし、 M 16 以上の場合は 2.0 mm を加えたものとした。,大規模な木造架構であったため、全体の建方が完了してからの建入れ修正ができなかったので、建方に並行してブロックごとに建入れ直しを行った。,集成材は、現場搬入から建方まで 15 日以上要したので、雨がかからないように防水シートで覆いをかけて保管した。,大断面材に設ける標準的なボルト孔の心ずれは、許容誤差を 2 mm 以内とした。,1,【ショーケン版】木材のボルト穴をそんなにガバガバにするな！鉄骨とは違うんだ。木造のボルト穴は、M16未満なら径＋「1.0mm」、M16以上なら径＋「1.5mm」までだ。そんなにデカい穴を開けたら、ボルトが遊んで構造がガタガタになるぞ！,【建龍版】大規模木造（集成材）のボルト孔に関する問題です。木材の接合部におけるボルト孔の径は、緩みによる耐力低下を防ぐため、ねじの呼びがM16未満の場合は「呼び径＋1.0mm」、M16以上の場合は「呼び径＋1.5mm」を標準とします。記述の数値は大きすぎるため不適当です。,,,,,,,,,,,,,,
H30-AM-33,H30,午前,33,施工管理,建設機械,揚重運搬機械に関する記述として、最も不適当なものはどれか。,ロングスパン工事用エレベーターの搬器には、周囲に堅固な手すりを設け、手すりには中さん及び幅木を取り付けなければならない。,ロングスパン工事用エレベーターは、安全上支障がない場合、搬器の昇降を知らせるための警報装置を備えないことができる。,建設用リフトは、土木、建築等の工事の作業に使用され、原則として荷のみを運搬することを目的とするエレベーターである。,建設用リフトの定格速度とは、搬器に積載荷重に相当する荷重の荷をのせて上昇させる場合の最高の速度をいう。,3,【ショーケン版】「建設用リフト」に人間を乗せてどうすんだ！建設用リフトは「荷物専用」だ。人は絶対に乗っちゃいけないって法律で決まってんだよ。「人と荷物」を運べるのは「エレベーター」だろ。名前と中身を勘違いしてたら、現場で人身事故が起きるぞ！,【建龍版】建設用揚重機の定義に関する問題です。「建設用リフト」は、ガイドレールに沿って昇降する搬器を用いて「荷を運搬する」ことを目的とした機械であり、クレーン等安全規則により「人を乗せることは禁止」されています。したがって「人及び荷を運搬すること」とする記述は誤りです。,,,,,,,,,,,,,,
