id,year,session,no,category,subcategory,question,choice1,choice2,choice3,choice4,answer,explanation_shoken,explanation_kenryu,imageUrl
R4-AM-18,R4,午前,18,建築学,空気調和設備,空気調和設備に関する記述として、最も不適当なものはどれか。,空気調和機は、一般にエアフィルタ、空気冷却器、空気加熱器、加湿器、送風機等で構成される装置である。,冷却塔は、温度上昇した冷却水を、空気と直接接触させて気化熱により冷却する装置である。,二重ダクト方式は、2 系統のダクトで送られた温風と冷風を、混合ユニットにより熱負荷に応じて混合量を調整して吹き出す方式である。,単一ダクト方式における CAV 方式は、負荷変動に対して風量を変える方式である。,4,【ショーケン版】CAVの「C」の意味を言ってみろ！「Constant（一定）」のCだろ。つまりCAVは「風量一定」方式なんだよ。風量を変えるのは「VAV（Variable：可変）」の仕事だ！英語の頭文字をちゃんと覚えとけ！,【建龍版】空調方式（ダクト方式）に関する問題です。「CAV方式（Constant Air Volume）」は、送風量を「一定」に保ち、送風温度を変化させて室温を調節する方式です。負荷変動に応じて「風量を変える」のは「VAV方式（Variable Air Volume）」の説明であり、不適当です。,
R4-AM-19,R4,午前,19,建築学,消火設備,消火設備に関する記述として、最も不適当なものはどれか。,屋内消火栓設備は、建物の内部に設置し、人がノズルを手に持ち、火点に向けて注水を行い、冷却作用により消火するものである。,閉鎖型ヘッドを用いる湿式スプリンクラー消火設備は、火災による煙を感知したスプリンクラーヘッドが自動的に開き、散水して消火するものである。,不活性ガス消火設備は、二酸化炭素等の消火剤を放出することにより、酸素濃度の希釈作用や気化するときの熱吸収による冷却作用により消火するものである。,水噴霧消火設備は、噴霧ヘッドから微細な霧状の水を噴霧することにより、冷却作用と窒息作用により消火するものである。,2,【ショーケン版】スプリンクラーが「煙」で開いたら大変なことになるぞ！タバコの煙でオフィスが水浸しだ。一般的なスプリンクラー（湿式）は、火の「熱」でヘッドの中の部品（可融片やバルブ）が溶けたり割れたりして水が出る仕組みなんだよ。「煙」じゃなくて「熱」だ！,【建龍版】スプリンクラー設備の仕組みに関する問題です。「閉鎖型スプリンクラーヘッド」は、火災の「熱」によって感熱体が作動し、放水口が開放されることで散水を開始します。煙を感知して作動するものではない（煙感知器は警報用）ため、記述は不適当です。,
R4-AM-20,R4,午前,20,施工管理,数量積算,積算に関する次の工事費の構成において、[ A ] [ B ] に当てはまる語句の組合せとして、正しいものはどれか。,A：工事原価、B：共通仮設費,A：工事原価、B：直接仮設費,A：現場工事費、B：共通仮設費,A：現場工事費、B：直接仮設費,1,【ショーケン版】この「家系図」みたいな工事費の構成は、暗記じゃなくて現場の金の流れで覚えろ！「純工事費」は直接工事費と「共通仮設費」を足したもん。それに監督の給料（現場管理費）を足したのが「工事原価」になるんだよ。Bを直接仮設費だと思った奴は、直接工事費の中身とゴッチャになってるぞ！,【建龍版】公共建築工事積算基準における構成の問題です。1. [ B ]：純工事費は「直接工事費」と「共通仮設費」から成ります。2. [ A ]：純工事費に現場管理費を加えたものが「工事原価」となります。この工事原価に一般管理費等を加えたものが「工事価格」となります。したがって正解は「1」です。,R4-AM-20.jpg
R4-AM-21,R4,午前,21,施工管理,仮設工事,乗入れ構台及び荷受け構台の計画に関する記述として、最も不適当なものはどれか。,クラムシェルが作業する乗入れ構台の幅は、ダンプトラック通過時にクラムシェルが旋回して対応する計画とし、 5 m とした。,道路から乗入れ構台までの乗込みスロープは、勾配を 1/6 とした。,乗入れ構台の支柱の位置は、使用する施工機械や車両の配置によって決めた。,乗入れ構台の幅は、車両の通行を 1 車線とするため、 4 m とした。,4,【ショーケン版】構台の幅が1車線で「1m」？おいおい、一輪車でも通す気か！ダンプが1台通る「1車線」なら、幅は最低でも「4m」なきゃ話にならねえだろ。逆に、道路からのスロープを「1/8」なんて緩くして場所を取るのも下手な鉄砲だ。1車線は4m、2車線なら8m、これ現場の常識だぞ！,【建龍版】乗入れ構台の計画に関する問題です。車両が通行する乗入れ構台の幅員は、1車線（片側通行）の場合で「4m以上」、2車線（すれ違い）の場合で「8m以上」を標準とします。1mとする記述は明らかに不足しており不適当です。なお、スロープ勾配は1/6以内が標準です。,
R4-AM-22,R4,午前,22,施工管理,土工事,土工事に関する記述として、最も不適当なものはどれか。,根切り底面下に被圧帯水層があり、盤ぶくれの発生が予測されたため、ディープウェル工法で地下水位を低下させた。,法付けオープンカットの法面保護をモルタル吹付けで行うため、水抜き孔を設けた。,粘性土地盤を法付けオープンカット工法で掘削するため、円弧すべりに対する安定を検討した。,ヒービングの発生が予測されたため、ウェルポイントで掘削場内外の地下水位を低下させた。,4,【ショーケン版】「ヒービング」を水抜き（ウェルポイント）で止めようとするな！ヒービングは「粘土」が回り込んでくる現象だ。ウェルポイントで水を抜くのが効くのは「砂」の時のボイリングやパイピングだろ！ヒービングを止めたきゃ、山留め壁を固い層までぶち込むか、地盤改良するしかねえんだよ。,【建龍版】地盤の破壊現象への対策に関する問題です。「ヒービング」は軟弱な粘性土地盤において、壁背面の土圧により底面が盛り上がる現象です。これに対しウェルポイント等の地下水低下工法は、砂質土地盤の「ボイリング」対策には有効ですが、ヒービング対策としては不適当です。,
R4-AM-23,R4,午前,23,施工管理,山留め工事,山留め工事の管理に関する記述として、最も不適当なものはどれか。,傾斜計を用いて山留め壁の変形を計測する場合には、山留め壁下端の変位量に注意する。,山留め壁周辺の地盤の沈下を計測するための基準点は、工事の影響を受けない付近の構造物に設置する。,山留め壁は、変形の管理基準値を定め、その計測値が管理基準値に近づいた場合の具体的な措置をあらかじめ計画する。,盤圧計は、切梁と火打ち材との交点付近を避け、切梁の中央部に設置する。,4,【ショーケン版】「盤圧計（応力計）」をそんな適当な場所に付けるな！切梁の力を正確に測りたいなら、端っこの「火打ち」が取り付いてる付近に付けて、しっかり圧力が乗るようにしなきゃ意味ねえだろ。中央部じゃたわみの影響とかで正確な数字が出ねえぞ！,【建龍版】山留めの計測管理に関する問題です。切梁の軸力を測定する「盤圧計（油圧計）」や応力計は、応力が集中しやすく、かつ安定して測定できる「切梁の端部（火打ち金物の近傍）」に設置するのが原則です。中央部とする記述は不適当です。,
R4-AM-24,R4,午前,24,施工管理,杭工事,場所打ちコンクリート杭地業に関する記述として、最も不適当なものはどれか。,コンクリートの打込みにおいて、トレミー管のコンクリート中への挿入長さが長すぎると、コンクリートの流出が悪くなるため、最長でも 6 m 程度とした。,アースドリル工法における鉄筋かごのスペーサーは、孔壁を損傷させないよう、平鋼を加工したものを用いた。,オールケーシング工法における孔底処理は、孔内水がない場合やわずかな場合にはハンマーグラブにより掘りくずを除去した。,リバース工法における孔内水位は、地下水位より 2 m 程度高く保った。,1,【ショーケン版】トレミー管を「6m」も突っ込んでおく奴があるか！そんなことしたら中でコンクリが詰まるか、管が抜けなくなるぞ。トレミー管の挿入深さは「2m〜4m」くらいでこまめに調整して、上げ下げするのがプロの杭打ちだ。6mは欲張りすぎだ！,【建龍版】場所打ち杭のコンクリート打設に関する問題です。トレミー管の先端は、常にコンクリート内に「2m以上」挿入されている必要がありますが、逆に長すぎると流動性を阻害するため、一般に「4m（〜6m）」を超えないように管理します。本問では1番の基準値や2番の平鋼スペーサーの是非が問われますが、標準仕様では「2m以上」かつ「こまめな引き抜き」が強調されます。（※アースドリルではD13鉄筋スペーサーが標準のため2も不適当な場合があります）,
R4-AM-25,R4,午前,25,施工管理,鉄筋工事,鉄筋のガス圧接に関する記述として、最も不適当なものはどれか。ただし、鉄筋は SD 345 の D 29 とする。,隣り合うガス圧接継手の位置は、 400 mm 程度ずらした。,圧接部のふくらみの長さは、鉄筋径の 1.1 倍以上とした。,"柱主筋のガス圧接継手位置は、梁上端から 500 mm 以上、 1,500 mm 以下、かつ柱の内法高さの 3/4 以下とした。",鉄筋の中心軸の偏心量は、鉄筋径の 1/5 以下とした。,1,【ショーケン版】「D29」の圧接を並べて打つなよ！隣り合う継手をずらす（千鳥にする）距離は、鉄筋径の「25倍」か、せめて「400mm以上」離さなきゃ強度が不安だろ。300mmじゃあ D29の25倍（約725mm）に全然足りねえ。もっとガッツリ離せ！,【建龍版】鉄筋ガス圧接の配筋規定に関する問題です。隣り合う鉄筋の継手位置は、構造上の弱点とならないよう相互に「400mm以上」ずらすことが標準仕様書（JASS 5）等で規定されています。300mmとする記述は不足しており不適当です。また、偏心量は「径の1/5以下」が正しい規定です。,
R4-AM-26,R4,午前,26,施工管理,コンクリート工事,コンクリートの調合に関する記述として、最も不適当なものはどれか。,普通コンクリートに再生骨材 H を用いる場合の水セメント比の最大値は、 60 % とする。,コンクリートの調合強度を定める際に使用する圧縮強度の標準偏差は、実績がない場合、 3.0 N/mm2 とする。,単位水量は、 185 kg/m3 以下とし、コンクリートの品質が得られる範囲内で、できるだけ小さくする。,高強度コンクリートに含まれる塩化物量は、塩化物イオン量として 0.30 kg/m3 以下とする。,2,【ショーケン版】実績がない工場の「標準偏差（ばらつき）」を、たった「1.5」で信用するなんて甘すぎるぞ！初めて頼むような工場なら、品質がどれくらいブレるかわからねえんだから、安全を見込んで標準偏差は「3.0 N/mm2」以上で計算するのがJASS 5のルールだ！1.5なんてのは超優秀な工場の数字だ！,【建龍版】コンクリートの調合強度（標準偏差）に関する問題です。圧縮強度の標準偏差は、実績が不明な場合、安全を見て「3.0 N/mm2」以上として算出します。1.5 N/mm2 とする記述は過小評価であり、調合強度が不足する恐れがあるため不適当です。,
R4-AM-27,R4,午前,27,施工管理,鉄骨工事,高力ボルト接合に関する記述として、最も不適当なものはどれか。,締付け後の高力ボルトの余長は、ねじ山 1 〜 6 山までの範囲であることを確認した。,ねじの呼びが M 22 のトルシア形高力ボルトの長さは、締付け長さに 35 mm を加えた値を標準とした。,高力ボルトの接合部で肌すきが 1 mm を超えたため、フィラープレートを入れた。,ナット回転法による締付け完了後の検査は、1次締付け後の本締めによるナット回転量が 120° ± 30° の範囲にあるものを合格とした。,4,【ショーケン版】ナット回転法の合格範囲を「±45度」なんて甘くしてどうすんだ！回転量が多すぎても少なすぎてもボルトがダメになる。ナット回転法の許容範囲は「120度 ± 30度」だ。15度もオマケしちゃ緩すぎだぞ！,【建龍版】高力ボルトのナット回転法に関する問題です。1次締付け後の本締めによるナット回転量の合格判定基準は、原則として「120° ± 30°」です。±45°とする記述は、許容範囲が広すぎて不適当です。なお、M22のボルト長さに35mmを加える規定は正しいです。,
R4-AM-28,R4,午前,28,施工管理,鉄骨工事,大空間鉄骨架構の建方に関する記述として、最も不適当なものはどれか。,リフトアップ工法は、地組みした所定の大きさのブロックをクレーン等で吊り上げて架構を構築する工法である。,総足場工法は、必要な高さまで足場を組み立てて、作業用の構台を全域にわたり設置し、架構を構築する工法である。,移動構台工法は、移動構台上で所定の部分の屋根鉄骨を組み立てた後、構台を移動させ、順次架構を構築する工法である。,スライド工法は、作業構台上等で所定の部分の屋根鉄骨を組み立てた後、そのユニットを所定位置まで順次滑動横引きしていき、最終的に架構全体を構築する工法である。,1,【ショーケン版】工法の名前をゴッチャにすんな！クレーンでブロックを吊り上げるのは「ブロック工法」そのまんまだろ。リフトアップってのは、屋根全体を地面で組んでから、ジャッキで「グーッ」と持ち上げるやり方のことだ！名前と中身が一致してねえぞ！,【建龍版】鉄骨の特殊建方工法に関する問題です。「リフトアップ工法」は、大屋根全体などを地上で組み立て、ジャッキ等を用いて所定の高さまで垂直に引き上げる工法です。記述の「ブロックをクレーン等で吊り上げる」のは「ブロック工法」の説明であり、不適当です。,
R4-AM-29,R4,午前,29,施工管理,木造工事,木質軸組構法に関する記述として、最も不適当なものはどれか。,1階及び2階の上下同位置に構造用面材の耐力壁を設けるため、胴差し部において、構造用面材相互間に 6 mm のあきを設けた。,接合に用いるラグスクリューは、先孔にスパナを用いて回しながら締め付けた。,接合金物のボルトの締付けは、座金が木材へ軽くめり込む程度とし、工事中、木材の乾燥収縮により緩んだナットは締め直した。,集成材にあけるボルト孔の間隔は、許容誤差を ± 3 mm とした。,4,【ショーケン版】集成材のボルト穴の「間隔」に、たった±1mmなんて精度出せるか！木は生き物なんだから少しは動く。ボルト穴の間隔の許容誤差は、現場じゃ「±3mm」くらいで見とかなきゃ納まらねえぞ。1mmなんて機械工作じゃねえんだからよ！,【建龍版】木造の施工精度に関する問題です。大断面集成材等のボルト孔相互の間隔の許容誤差は、一般に「±2.0mm 〜 ±3.0mm」程度とされています。±1mmとする記述は木造工事の管理基準としては厳しすぎ、実務上の数値（±2〜3mm）と異なるため不適当とされるケースが多いです。,
R4-AM-30,R4,午前,30,施工管理,建設機械,揚重運搬機械に関する記述として、最も不適当なものはどれか。,建設用リフトは、土木、建築等の工事の作業で使用されるエレベーターで、原則として荷のみを運搬する。,タワークレーンのブーム等、高さが地表から 60 m 以上となる場合、原則として航空障害灯を設置する。,"移動式クレーンは、旋回範囲内に 6,600 V の配電線がある場合、配電線から安全距離を 2 m 以上確保する。",ロングスパン工事用エレベーターは、安全上支障がない場合、搬器の昇降を知らせるための警報装置を備えないことができる。,1,【ショーケン版】「建設用リフト」に人間を乗せてどうすんだ！建設用リフトは「荷物専用」だ。人は絶対に乗っちゃいけないって法律で決まってんだよ。「人と荷物」を運べるのは「工事用エレベーター」だろ。名前と中身を勘違いしてたら、現場で人身事故が起きるぞ！,【建龍版】建設用揚重機の定義に関する問題です。「建設用リフト」は、ガイドレールに沿って昇降する搬器を用いて「荷を運搬する」ことを目的とした機械であり、クレーン等安全規則により「人を乗せることは禁止」されています。したがって「人及び荷を運搬する」とする記述は不適当です。,
R4-AM-31,R4,午前,31,施工管理,防水工事,合成高分子系ルーフィングシート防水に関する記述として、最も不適当なものはどれか。,加硫ゴム系シート防水の接着工法において、平場部の接合部のシートの重ね幅は 100 mm 以上とし、立上りと平場との重ね幅は 150 mm 以上とした。,加硫ゴム系シート防水の接着工法において、出隅角の処理は、シートの張付け前に加硫ゴム系シートで増張りを行った。,塩化ビニル樹脂系シート防水の接着工法において、下地が ALC パネルのため、プライマーを塗布した。,エチレン酢酸ビニル樹脂系シート防水の密着工法において、接合部のシートの重ね幅は、幅方向、長手方向とも 40 mm 以上とした。,4,【ショーケン版】EVA樹脂（エチレン酢酸ビニル）のシートの重ねをたった「40mm」にするな！塩ビシートなら40mmでいい場合もあるが、密着工法のシート防水なら、重ねは最低でも「100mm」取らなきゃ水が入るぞ。シートの種類で重ね幅を使い分けろ！,【建龍版】シート防水の施工仕様に関する問題です。エチレン酢酸ビニル樹脂系（EVA）シート防水の接合部重ね幅は、一般に「100mm以上」とされています。40mmとする記述は、塩化ビニル樹脂系シートの一部の接合基準（熱溶着等）と混同しており不適当です。,
R4-AM-32,R4,午前,32,施工管理,シーリング工事,シーリング工事に関する記述として、最も不適当なものはどれか。,外壁 ALC パネル張りに取り付けるアルミニウム製建具の周囲の目地シーリングは、2 面接着とした。,先打ちしたポリウレタン系シーリング材に、ポリサルファイド系シーリング材を打ち継いだ。,シーリング材の打継ぎ箇所は、目地の交差部及びコーナー部を避け、そぎ継ぎとした。,コンクリートの水平打継ぎ目地のシーリングは、1 成分形変成シリコーン系シーリング材を用いた。,1,【ショーケン版】サッシ周りのシーリングを「3面接着」にしてどうすんだ！建物の動きでシーリングがブチッと切れるぞ。ワーキングジョイント（動く目地）は、底をくっつけない「2面接着」が鉄則だ。面接着なんて、シーリングの基本を忘れてる証拠だぞ！,【建龍版】シーリングの接着方式に関する問題です。サッシ周りやALCパネル目地などは、建物の挙動に追従させるため、ボンドブレーカー等を用いて底面の接着を防ぐ「2面接着」とするのが原則です。3面（面）接着とする記述は、シーリング材の破断を招くため不適当です。,
R4-AM-33,R4,午前,33,施工管理,タイル工事,セメントモルタルによる壁タイル後張り工法に関する記述として、最も不適当なものはどれか。,密着張りの張付けモルタルは 2 度塗りとし、タイルは上から下に段置きに数段張り付けたのち、それらの間のタイルを張った。,モザイクタイル張りの張付けモルタルは 1 度塗りとし、層目はこて圧をかけて塗り付けた。,改良積上げ張りの張付けモルタルは、タイル裏面に塗厚 4 〜 6 mm で塗り付けた。,改良圧着張りの下地面への張付けモルタルは 1 度塗りとし、その合計の塗厚を 3 〜 6 mm とした。,2,【ショーケン版】モザイクタイルのモルタルを「1回」で済ますな！塗りムラが出てタイルが浮くぞ。モザイクタイル張りは「2度塗り」が基本だ。1回目で下地に食い込ませ、2回目で厚みを調整する。手間を惜しむな！,【建龍版】壁タイルの施工工法に関する問題です。モザイクタイル張りにおいて、下地への張付けモルタルは、十分な付着力を確保するため「2度塗り（1回目をしごき塗りとする）」とし、総塗厚を3mm程度とするのが標準です。1度塗りとする記述は不適当です。,
R4-AM-34,R4,午前,34,施工管理,屋根工事,心木なし瓦棒葺に関する記述として、最も不適当なものはどれか。,水上部分と壁との取合い部に設ける雨押えは、壁際立上がりを 120 mm とした。,通し吊子の鉄骨母屋への取付けは、平座金を付けたドリルねじで、下葺材、野地板を貫通させ母屋に固定した。,棟部の納めは、溝板の水上端部に八千代折りとした水返しを設け、棟包みを取り付けた。,けらば部の溝板の幅は、瓦棒の働き幅の 1/2 以下とした。,1,【ショーケン版】雨押えの立ち上げが「45mm」？そんなの小雨でも水が入るわ！屋根と壁の取り合いは雨漏りの急所なんだぞ。雨押えの壁際立ち上げは、最低でも「120mm以上（または250mm）」は確保しなきゃ現場監督として失格だ！,【建龍版】金属板葺（瓦棒葺）の雨仕舞に関する問題です。屋根と壁の取合い部に設ける雨押えの立ち上げ高さは、雨水の浸入を防止するため「120mm以上」とすることが標準（JASS 12）です。45mmとする記述は著しく不足しており不適当です。,
R4-AM-35,R4,午前,35,施工管理,仕上塗材工事,防水形合成樹脂エマルション系複層仕上塗材(防水形複層塗材 E)仕上げに関する記述として、最も不適当なものはどれか。,上塗材は、0.3 kg/m2 を 2 回塗りとした。,主材の基層塗りは、1.5 kg/m2 を 2 回塗りとした。,出隅、入隅、目地部、開口部まわり等に行う増塗りは、主材塗りの前に行った。,主材の凹凸状の模様塗りは、見本と同様になるように、吹付け工法により行った。,3,【ショーケン版】増塗りを「後」でやってどうすんだ！入隅や開口部の角（コーナー）は割れやすいから、あらかじめ「先」に塗って補強しておくのが鉄則だろ。主材を塗った後に塗ったら、ただの厚塗りになっちまうぞ。手順を逆にするな！,【建龍版】仕上塗材（防水形複層塗材E）の施工に関する問題です。防水性能を確保するため、クラックの発生しやすい隅角部や開口部、目地部は、あらかじめ主材による「増塗り（補強塗り）」を「主材塗りの前」に行っておく必要があります。主材塗りの後に行うとする記述は不適当です。,
